{
  "acceptance_run": null,
  "blockers": [],
  "delivery": null,
  "derived_from": {
    "current_inputs_sha256": "a2aacca4fdd76a8cceea60876f195fbd90b37f9cf08070db39e0ae8ff63f419d",
    "events_sha256": "e3b0c44298fc1c149afbf4c8996fb92427ae41e4649b934ca495991b7852b855",
    "last_seq": 0
  },
  "digests": {
    "corpus_tree_sha256": null,
    "evidence_manifest_sha256": null,
    "plan_sha256": "69d1594acfd5c7f84f41b77adacac068bcc5c137ace351793fc28b9d4cecd472",
    "spec_sha256": null,
    "test_bundle_sha256": null
  },
  "execution_policy": null,
  "gates": {
    "acceptance": {
      "basis_event": null,
      "status": "pending"
    },
    "candidate": {
      "basis_event": null,
      "status": "pending"
    },
    "consolidated_review": {
      "basis_event": null,
      "status": "pending"
    },
    "corpus_closeout": {
      "basis_event": null,
      "status": "pending"
    },
    "evidence": {
      "basis_event": null,
      "status": "pending"
    },
    "integration": {
      "basis_event": null,
      "status": "pending"
    },
    "lot_reviews": {
      "basis_event": null,
      "status": "pending"
    },
    "release": {
      "basis_event": null,
      "status": "pending"
    },
    "specification": {
      "basis_event": null,
      "status": "pending"
    },
    "technical_plan": {
      "basis_event": null,
      "status": "pending"
    }
  },
  "legacy": null,
  "lots": {
    "LOT-1": {
      "attempt_budget_extensions": 0,
      "attempts": 0,
      "diff_budget_override": null,
      "diff_sha256": null,
      "effective_max_attempts": 2,
      "preimplementation_contract": null,
      "refactor_approval": null,
      "refactor_escalation": null,
      "reservation_id": null,
      "review": null,
      "status": "pending",
      "workspace_snapshot": null
    }
  },
  "phase": "draft",
  "provenance": {
    "candidate_binding": null,
    "candidate_sha": null,
    "consolidated_snapshot": null,
    "evidence_sha": null,
    "integration_snapshot": null,
    "publication": null,
    "tested_sha": null
  },
  "ready_lots": [],
  "reservations": {},
  "reviews": {
    "consolidated": null,
    "release": null
  },
  "run_id": null,
  "run_mode": null,
  "v": 3
}
